[
  {
    "id": "SNK-01",
    "category": "SANKSI",
    "question": "Apa sanksi untuk Pasal 27A UU ITE?",
    "contexts": ["Pasal 27A : Setiap Orang dengan sengaja menyerang kehormatan atau nama baik orang lain dengan cara menuduhkan suatu hal, dengan maksud supaya hal tersebut diketahui umum dalam bentuk Informasi Elektronik dan/atau Dokumen Elektronik yang dilakukan melalui Sistem Elektronik. | Sumber : ITE",
	"Pasal 45 : (1) Setiap Orang yang dengan sengaja dan tanpa hak menyiarkan, mempertunjukkan, mendistribusikan, mentransmisikan, dan/atau membuat dapat diaksesnya Informasi Elektronik dan/atau Dokumen Elektronik yang memiliki muatan yang melanggar kesusilaan untuk diketahui umum sebagaimana dimaksud dalam Pasal 27 ayat (1) dipidana dengan pidana penjara paling lama 6 (enam) tahun dan/atau denda paling banyak Rp1.000.000.000,00 (satu miliar rupiah). (2) Perbuatan sebagaimana dimaksud pada ayat (1) tidak dipidana dalam hal: a. dilakukan demi kepentingan umum; b. dilakukan untuk pembelaan atas dirinya sendiri; atau c. Informasi Elektronik dan/atau Dokumen Elektronik tersebut merupakan karya seni, budaya, olahraga, kesehatan, dan/atau ilmu pengetahuan. (3) Setiap Orang yang dengan sengaja dan tanpa hak mendistribusikan, mentransmisikan, dan/atau membuat dapat diaksesnya Informasi Elektronik dan/atau Dokumen Elektronik yang memiliki muatan perjudian sebagaimana dimaksud dalam Pasal 27 ayat (2) dipidana dengan pidana penjara paling lama 10 (sepuluh) tahun dan/atau denda paling banyak Rp10.000.000.000,00 (sepuluh miliar rupiah). (4) Setiap Orang yang dengan sengaja menyerang kehormatan atau nama baik orang lain dengan cara menuduhkan suatu hal, dengan maksud supaya hal tersebut diketahui umum dalam bentuk Informasi Elektronik dan/atau Dokumen Elektronik yang dilakukan melalui Sistem Elektronik sebagaimana dimaksud dalam Pasal 27A dipidana dengan pidana penjara paling lama 2 (dua) tahun dan/atau denda paling banyak Rp400.000.000,00 (empat ratus juta rupiah). (5) Ketentuan sebagaimana dimaksud pada ayat (4) merupakan tindak pidana aduan yang hanya dapat dituntut atas pengaduan korban atau orang yang terkena tindak pidana dan bukan oleh badan hukum. (6) Dalam hal perbuatan sebagaimana dimaksud pada ayat (4) tidak dapat dibuktikan kebenarannya dan bertentangan dengan apa yang diketahui padahal telah diberi kesempatan untuk membuktikannya, dipidana karena fitnah dengan pidana penjara paling lama 4 (empat) tahun dan/atau denda paling banyak Rp750.000.000,00 (tujuh ratus lima puluh juta rupiah). (7) Perbuatan sebagaimana dimaksud pada ayat (4) tidak dipidana dalam hal: a. dilakukan untuk kepentingan umum; atau b. dilakukan karena terpaksa membela diri. (8) Setiap Orang yang dengan sengaja dan tanpa hak mendistribusikan dan/atau mentransmisikan Informasi Elektronik dan/atau Dokumen Elektronik, dengan maksud untuk menguntungkan diri sendiri atau orang lain secara melawan hukum, memaksa orang dengan ancaman kekerasan untuk: a. memberikan suatu barang, yang sebagian atau seluruhnya milik orang tersebut atau milik orang lain; atau b. memberi utang, membuat pengakuan utang, atau menghapuskan piutang, sebagaimana dimaksud dalam Pasal 27B ayat (1) dipidana dengan pidana penjara paling lama 6 (enam) tahun dan/atau denda paling banyak Rp1.000.000.000,00 (satu miliar rupiah). (9) Dalam hal perbuatan sebagaimana dimaksud pada ayat (8) dilakukan dalam lingkungan keluarga, penuntutan pidana hanya dapat dilakukan atas aduan. (10) Setiap Orang yang dengan sengaja dan tanpa hak mendistribusikan dan/atau mentransmisikan Informasi Elektronik dan/atau Dokumen Elektronik, dengan maksud untuk menguntungkan diri sendiri atau orang lain secara melawan hukum, dengan ancaman pencemaran atau dengan ancaman akan membuka rahasia, memaksa orang supaya: a. memberikan suatu barang yang sebagian atau seluruhnya milik orang tersebut atau milik orang lain; atau b. memberi utang, membuat pengakuan utang, atau menghapuskan piutang, sebagaimana dimaksud dalam Pasal 27B ayat (2) dipidana dengan pidana penjara paling lama 6 (enam) tahun dan/atau denda paling banyak Rp1.000.000.000,00 (satu miliar rupiah). (11) Tindak pidana sebagaimana dimaksud pada ayat (10) hanya dapat dituntut atas pengaduan korban tindak pidana. | Sumber : ITE"],
    "answer": "Sanksi untuk Pasal 27A diatur dalam Pasal 45 ayat (4).\n\nPidana penjara paling lama 2 tahun dan/atau denda paling banyak Rp400.000.000,00 (empat ratus juta rupiah).",
    "ground_truths": ["Pasal 27A", "Pasal 45"]
  },
  {
    "id": "SNK-02",
    "category": "SANKSI",
    "question": "Ancaman pidana untuk Pasal 29 UU ITE itu apa?",
    "contexts": ["Pasal 29 : Setiap Orang dengan sengaja dan tanpa hak mengirimkan Informasi Elektronik dan/atau Dokumen Elektronik secara langsung kepada korban yang berisi ancaman kekerasan dan/atau menakut-nakuti. | Sumber : ITE ",
	"Pasal 45B : Setiap Orang yang dengan sengaja dan tanpa hak mengirimkan Informasi Elektronik dan/atau Dokumen Elektronik secara langsung kepada korban yang berisi ancaman kekerasan dan/atau menakut-nakuti sebagaimana dimaksud dalam Pasal 29 dipidana dengan pidana penjara paling lama 4 (empat) tahun dan/atau denda paling banyak Rp750.000.000,00 (tujuh ratus lima puluh juta rupiah). | Sumber : ITE"
	],
    "answer": "Sanksi untuk Pasal 29 diatur dalam Pasal 45B.\n\nDalam konteks ini, pasangan pidana yang terkait dengan Pasal 29 adalah: pidana penjara paling lama 4 (empat) tahun dan/atau denda paling banyak Rp750.000.000,00 (tujuh ratus lima puluh juta rupiah).",
    "ground_truths": ["Pasal 29", "Pasal 45B"]
  },
  {
    "id": "SNK-03",
    "category": "SANKSI",
    "question": "Apa sanksi untuk Pasal 35 UU ITE?",
    "contexts": ["Pasal 35 : Setiap Orang dengan sengaja dan tanpa hak atau melawan hukum melakukan manipulasi, penciptaan, perubahan, penghilangan, pengrusakan Informasi Elektronik dan/atau Dokumen Elektronik dengan tujuan agar Informasi Elektronik dan/atau Dokumen Elektronik tersebut dianggap seolah-olah data yang otentik. | Sumber : ITE", 
	"Pasal 51 : (1) Setiap Orang yang memenuhi unsur sebagaimana dimaksud dalam Pasal 35 dipidana dengan pidana penjara paling lama 12 (dua belas) tahun dan/atau denda paling banyak Rp12.000.000.000,00 (dua belas miliar rupiah). (2) Setiap Orang yang memenuhi unsur sebagaimana dimaksud dalam Pasal 36 dipidana dengan pidana penjara paling lama 12 (dua belas) tahun dan/atau denda paling banyak Rp12.000.000.000,00 (dua belas miliar rupiah). | Sumber : ITE"
	],
    "answer": "Sanksi untuk Pasal 35 diatur dalam Pasal 51 ayat (1).\n\nPidana penjara paling lama 12 tahun dan/atau denda paling banyak Rp12.000.000.000,00.",
    "ground_truths": ["Pasal 35", "Pasal 51"]
  },
  {
    "id": "SNK-04",
    "category": "SANKSI",
    "question": "Kalau pencurian, ancaman pidananya apa (sebutkan pasalnya)?",
    "contexts": ["Pasal 483 : (1)Dipidana karena pengancaman dengan pidana penjara paling lama 4 (empat) tahun atau pidana denda paling banyak kategori IV, Setiap Orang yang dengan maksud untuk menguntungkan diri sendiri atau orang lain secara melawan hukum, dengan ancaman pencemaran atau pencemaran tertulis atau dengan ancaman akan membuka rahasia, memaksa orang supaya: a.memberikan suatu Barang yang sebagian atau seluruhnya milik orang tersebut atau milik orang lain; atau b.memberi utang, membuat pengakuan utang, atau menghapuskan piutang. (2)Tindak Pidana sebagaimana dimaksud pada ayat (1) hanya dapat dituntut atas pengaduan Korban Tindak Pidana. | Sumber : KUHP", 
	"Pasal 486 : Ketentuan ini mengatur Tindak Pidana penggelapan. Pada Tindak Pidana penggelapan, Barang yang bersangkutan sudah dikuasai secara nyata oleh pelaku Tindak Pidana. Hal ini berbeda dengan pencurian di mana Barang tersebut belum berada di tangan pelaku Tindak Pidana. Saat timbulnya niat untuk memiliki Barang tersebut secara melawan hukum, juga menentukan perbedaan antara penggelapan dan pencurian. Apabila niat memiliki sudah ada pada waktu Barang tersebut diambil, maka perbuatan tersebut merupakan Tindak Pidana pencurian, sedang pada penggelapan, niat memiliki tersebut baru ada setelah Barang yang bersangkutan untuk beberapa waktu sudah berada di tangan pelaku. Unsur Tindak Pidana penggelapan lainnya adalah bahwa pelaku menguasai Barang yang hendak dimiliki tersebut bukan karena Tindak Pidana, misalnya suatu Barang yang berada dalam penguasaan pelaku Tindak Pidana sebagai jaminan utang piutang yang kemudian dijual tanpa izin pemiliknya. | Sumber : KUHP", 
	"Pasal 482 : (1)Dipidana karena pemerasan dengan pidana penjara paling lama 9 (sembilan) tahun, Setiap Orang yang dengan maksud untuk menguntungkan diri sendiri atau orang lain secara melawan hukum, memaksa orang dengan Kekerasan atau Ancaman Kekerasan untuk: a.memberikan suatu Barang, yang sebagian atau seluruhnya milik orang tersebut atau milik orang lain; atau b.memberi utang, membuat pengakuan utang, atau menghapuskan piutang. (2)Ketentuan sebagaimana dimaksud dalam Pasal 479 ayat (2) sampai dengan ayat (4) berlaku juga bagi pemerasan sebagaimana dimaksud pada ayat (1). | Sumber : KUHP", 
	"Pasal 479 : (1)Setiap Orang yang melakukan pencurian yang didahului, disertai, atau diikuti dengan Kekerasan atau Ancaman Kekerasan terhadap orang, dengan maksud untuk mempersiapkan atau mempermudah pencurian atau dalam hal tertangkap tangan, untuk memungkinkan dirinya sendiri atau orang lain untuk tetap menguasai Barang yang dicurinya, dipidana dengan pidana penjara paling lama 9 (sembilan) tahun. (2)Dipidana dengan pidana penjara paling lama 12 (dua belas) tahun, Setiap Orang yang melakukan perbuatan sebagaimana dimaksud pada ayat (1): a.pada Malam dalam sebuah rumah atau pekarangan tertutup yang ada rumahnya, di jalan umum, atau di dalam kendaraan angkutan umum yang sedang berjalan; b.pencurian dengan cara merusak, membongkar, memotong, memecah, Memanjat, memakai Anak Kunci Palsu, menggunakan perintah palsu, atau memakai pakaian jabatan palsu, untuk Masuk ke tempat melakukan Tindak Pidana atau sampai pada Barang yang diambil; c.yang mengakibatkan Luka Berat bagi orang; atau d.secara bersama-sama dan bersekutu. (3)Jika perbuatan sebagaimana dimaksud pada ayat (1) atau ayat (2) mengakibatkan matinya orang, dipidana dengan pidana penjara paling lama 15 (lima belas) tahun. (4)Jika perbuatan sebagaimana dimaksud pada ayat (1) mengakibatkan Luka Berat atau matinya orang yang dilakukan secara bersama-sama dan bersekutu disertai dengan salah satu hal sebagaimana dimaksud pada ayat (2) huruf a dan huruf b, dipidana dengan pidana mati atau penjara seumur hidup atau pidana penjara paling lama 20 (dua puluh) tahun. | Sumber : KUHP",
	"Pasal 477 : (1)Dipidana dengan pidana penjara paling lama 7 (tujuh) tahun atau pidana denda paling banyak kategori V, Setiap Orang yang melakukan: a.pencurian benda suci keagamaan atau kepercayaan; b.pencurian benda purbakala; c.pencurian Ternak atau Barang yang merupakan sumber mata pencaharian atau sumber nafkah utama seseorang; d.pencurian pada waktu ada kebakaran, ledakan, bencana alam, Kapal karam, Kapal terdampar, kecelakaan Pesawat Udara, kecelakaan kereta api, kecelakaan lalu lintas jalan, huru-hara, pemberontakan, atau Perang; e.pencurian pada Malam dalam suatu rumah atau dalam pekarangan tertutup yang ada rumahnya, yang dilakukan oleh orang yang adanya di situ tidak diketahui atau tidak dikehendaki oleh yang berhak; f.pencurian dengan cara merusak, membongkar, memotong, memecah, Memanjat, memakai Anak Kunci Palsu, menggunakan perintah palsu, atau memakai pakaian jabatan palsu, untuk Masuk ke tempat melakukan Tindak Pidana atau sampai pada Barang yang diambil; atau g.pencurian secara bersama-sama dan bersekutu. (2)Jika perbuatan sebagaimana dimaksud pada ayat (1) huruf e disertai dengan salah satu cara sebagaimana dimaksud pada ayat (1) huruf f dan huruf g, dipidana dengan pidana penjara paling lama 9 (sembilan) tahun. | Sumber : KUHP",
	"Pasal 476 : Setiap Orang yang mengambil suatu Barang yang sebagian atau seluruhnya milik orang lain, dengan maksud untuk dimiliki secara melawan hukum, dipidana karena pencurian, dengan pidana penjara paling lama 5 (lima) tahun atau pidana denda paling banyak kategori V. | Sumber : KUHP",
	"Pasal 489 : Dalam hal perbuatan sebagaimana dimaksud dalam Pasal 486 dilakukan oleh orang yang menerima Barang dari orang lain yang karena terpaksa menyerahkan Barang padanya untuk disimpan atau oleh wali, pengampu, pengurus atau pelaksana Surat wasiat, pengurus lembaga sosial atau yayasan terhadap Barang yang dikuasainya, dipidana dengan pidana penjara paling lama 5 (lima) tahun atau pidana denda paling banyak kategori V. | Sumber : KUHP"
	],
    "answer": "Pasal 476, yang menyatakan bahwa Setiap Orang yang mengambil suatu Barang yang sebagian atau seluruhnya milik orang lain, dengan maksud untuk dimiliki secara melawan hukum, dipidana karena pencurian, dengan pidana penjara paling lama 5 (lima) tahun atau pidana denda paling banyak kategori V.\n\nJawaban: Pasal 476.",
    "ground_truths": ["Pasal 476"]
  },
  {
    "id": "SNK-05",
    "category": "SANKSI",
    "question": "Kalau penggelapan, ancaman pidananya apa (sebutkan pasalnya)?",
    "contexts": ["Pasal 483 : (1)Dipidana karena pengancaman dengan pidana penjara paling lama 4 (empat) tahun atau pidana denda paling banyak kategori IV, Setiap Orang yang dengan maksud untuk menguntungkan diri sendiri atau orang lain secara melawan hukum, dengan ancaman pencemaran atau pencemaran tertulis atau dengan ancaman akan membuka rahasia, memaksa orang supaya: a.memberikan suatu Barang yang sebagian atau seluruhnya milik orang tersebut atau milik orang lain; atau b.memberi utang, membuat pengakuan utang, atau menghapuskan piutang. (2)Tindak Pidana sebagaimana dimaksud pada ayat (1) hanya dapat dituntut atas pengaduan Korban Tindak Pidana. | Sumber : KUHP", 
	"Pasal 486 : Ketentuan ini mengatur Tindak Pidana penggelapan. Pada Tindak Pidana penggelapan, Barang yang bersangkutan sudah dikuasai secara nyata oleh pelaku Tindak Pidana. Hal ini berbeda dengan pencurian di mana Barang tersebut belum berada di tangan pelaku Tindak Pidana. Saat timbulnya niat untuk memiliki Barang tersebut secara melawan hukum, juga menentukan perbedaan antara penggelapan dan pencurian. Apabila niat memiliki sudah ada pada waktu Barang tersebut diambil, maka perbuatan tersebut merupakan Tindak Pidana pencurian, sedang pada penggelapan, niat memiliki tersebut baru ada setelah Barang yang bersangkutan untuk beberapa waktu sudah berada di tangan pelaku. Unsur Tindak Pidana penggelapan lainnya adalah bahwa pelaku menguasai Barang yang hendak dimiliki tersebut bukan karena Tindak Pidana, misalnya suatu Barang yang berada dalam penguasaan pelaku Tindak Pidana sebagai jaminan utang piutang yang kemudian dijual tanpa izin pemiliknya. | Sumber : KUHP", 
	"Pasal 482 : (1)Dipidana karena pemerasan dengan pidana penjara paling lama 9 (sembilan) tahun, Setiap Orang yang dengan maksud untuk menguntungkan diri sendiri atau orang lain secara melawan hukum, memaksa orang dengan Kekerasan atau Ancaman Kekerasan untuk: a.memberikan suatu Barang, yang sebagian atau seluruhnya milik orang tersebut atau milik orang lain; atau b.memberi utang, membuat pengakuan utang, atau menghapuskan piutang. (2)Ketentuan sebagaimana dimaksud dalam Pasal 479 ayat (2) sampai dengan ayat (4) berlaku juga bagi pemerasan sebagaimana dimaksud pada ayat (1). | Sumber : KUHP", 
	"Pasal 479 : (1)Setiap Orang yang melakukan pencurian yang didahului, disertai, atau diikuti dengan Kekerasan atau Ancaman Kekerasan terhadap orang, dengan maksud untuk mempersiapkan atau mempermudah pencurian atau dalam hal tertangkap tangan, untuk memungkinkan dirinya sendiri atau orang lain untuk tetap menguasai Barang yang dicurinya, dipidana dengan pidana penjara paling lama 9 (sembilan) tahun. (2)Dipidana dengan pidana penjara paling lama 12 (dua belas) tahun, Setiap Orang yang melakukan perbuatan sebagaimana dimaksud pada ayat (1): a.pada Malam dalam sebuah rumah atau pekarangan tertutup yang ada rumahnya, di jalan umum, atau di dalam kendaraan angkutan umum yang sedang berjalan; b.pencurian dengan cara merusak, membongkar, memotong, memecah, Memanjat, memakai Anak Kunci Palsu, menggunakan perintah palsu, atau memakai pakaian jabatan palsu, untuk Masuk ke tempat melakukan Tindak Pidana atau sampai pada Barang yang diambil; c.yang mengakibatkan Luka Berat bagi orang; atau d.secara bersama-sama dan bersekutu. (3)Jika perbuatan sebagaimana dimaksud pada ayat (1) atau ayat (2) mengakibatkan matinya orang, dipidana dengan pidana penjara paling lama 15 (lima belas) tahun. (4)Jika perbuatan sebagaimana dimaksud pada ayat (1) mengakibatkan Luka Berat atau matinya orang yang dilakukan secara bersama-sama dan bersekutu disertai dengan salah satu hal sebagaimana dimaksud pada ayat (2) huruf a dan huruf b, dipidana dengan pidana mati atau penjara seumur hidup atau pidana penjara paling lama 20 (dua puluh) tahun. | Sumber : KUHP",
	"Pasal 477 : (1)Dipidana dengan pidana penjara paling lama 7 (tujuh) tahun atau pidana denda paling banyak kategori V, Setiap Orang yang melakukan: a.pencurian benda suci keagamaan atau kepercayaan; b.pencurian benda purbakala; c.pencurian Ternak atau Barang yang merupakan sumber mata pencaharian atau sumber nafkah utama seseorang; d.pencurian pada waktu ada kebakaran, ledakan, bencana alam, Kapal karam, Kapal terdampar, kecelakaan Pesawat Udara, kecelakaan kereta api, kecelakaan lalu lintas jalan, huru-hara, pemberontakan, atau Perang; e.pencurian pada Malam dalam suatu rumah atau dalam pekarangan tertutup yang ada rumahnya, yang dilakukan oleh orang yang adanya di situ tidak diketahui atau tidak dikehendaki oleh yang berhak; f.pencurian dengan cara merusak, membongkar, memotong, memecah, Memanjat, memakai Anak Kunci Palsu, menggunakan perintah palsu, atau memakai pakaian jabatan palsu, untuk Masuk ke tempat melakukan Tindak Pidana atau sampai pada Barang yang diambil; atau g.pencurian secara bersama-sama dan bersekutu. (2)Jika perbuatan sebagaimana dimaksud pada ayat (1) huruf e disertai dengan salah satu cara sebagaimana dimaksud pada ayat (1) huruf f dan huruf g, dipidana dengan pidana penjara paling lama 9 (sembilan) tahun. | Sumber : KUHP",
	"Pasal 476 : Setiap Orang yang mengambil suatu Barang yang sebagian atau seluruhnya milik orang lain, dengan maksud untuk dimiliki secara melawan hukum, dipidana karena pencurian, dengan pidana penjara paling lama 5 (lima) tahun atau pidana denda paling banyak kategori V. | Sumber : KUHP",
	"Pasal 489 : Dalam hal perbuatan sebagaimana dimaksud dalam Pasal 486 dilakukan oleh orang yang menerima Barang dari orang lain yang karena terpaksa menyerahkan Barang padanya untuk disimpan atau oleh wali, pengampu, pengurus atau pelaksana Surat wasiat, pengurus lembaga sosial atau yayasan terhadap Barang yang dikuasainya, dipidana dengan pidana penjara paling lama 5 (lima) tahun atau pidana denda paling banyak kategori V. | Sumber : KUHP"
	],
    "answer": "Dalam Pasal 486 dikatakan bahwa Tindak Pidana penggelapan dilakukan oleh pelaku yang menguasai Barang yang bersangkutan bukan karena Tindak Pidana. Oleh karena itu, ancaman pidanan untuk Tindak Pidana penggelapan adalah pidana penjara paling lama 5 (lima) tahun atau pidana denda paling banyak kategori V (Pasal 489).",
    "ground_truths": ["Pasal 486"]
  }
]